{
  "format": "lattice-security/parameter-set",
  "version": 1,
  "id": "ssle-script",
  "name": "SSLE 参数方案（脚本）",
  "description": "从 ssle.py 的有效 SMART_EXACT 调用迁移；源码中完全重复的 SSLE 1 调用仅保留一次。",
  "tags": ["migrated", "python", "ssle"],
  "cases": [
    {
      "id": "commit-1",
      "name": "Commit 1",
      "problem": {
        "kind": "lwe",
        "dimension": 512,
        "modulus": "12289",
        "samples": { "kind": "unlimited" },
        "secret": { "kind": "sparse_ternary" },
        "error": { "kind": "discrete_gaussian", "standard_deviation": "3.7" }
      }
    },
    {
      "id": "commit-2",
      "name": "Commit 2",
      "problem": {
        "kind": "lwe",
        "dimension": 1024,
        "modulus": "18433",
        "samples": { "kind": "unlimited" },
        "secret": { "kind": "sparse_ternary" },
        "error": { "kind": "discrete_gaussian", "standard_deviation": "0.849" }
      }
    },
    {
      "id": "commit-3",
      "name": "Commit 3",
      "problem": {
        "kind": "lwe",
        "dimension": 1024,
        "modulus": "40961",
        "samples": { "kind": "unlimited" },
        "secret": { "kind": "sparse_ternary" },
        "error": { "kind": "discrete_gaussian", "standard_deviation": "0.849" }
      }
    },
    {
      "id": "ssle-1",
      "name": "SSLE 1",
      "problem": {
        "kind": "lwe",
        "dimension": 4096,
        "modulus": "1267650599969977236268072599553",
        "samples": { "kind": "unlimited" },
        "secret": { "kind": "sparse_ternary" },
        "error": { "kind": "discrete_gaussian", "standard_deviation": "0.849" }
      }
    },
    {
      "id": "ssle-2",
      "name": "SSLE 2",
      "problem": {
        "kind": "lwe",
        "dimension": 4096,
        "modulus": "649033470896967801447398927572993",
        "samples": { "kind": "unlimited" },
        "secret": { "kind": "sparse_ternary" },
        "error": { "kind": "discrete_gaussian", "standard_deviation": "5.6" }
      }
    },
    {
      "id": "ssle-3",
      "name": "SSLE 3",
      "problem": {
        "kind": "lwe",
        "dimension": 4096,
        "modulus": "1298070268741604259594248958689281",
        "samples": { "kind": "unlimited" },
        "secret": { "kind": "sparse_ternary" },
        "error": { "kind": "discrete_gaussian", "standard_deviation": "11.12" }
      }
    },
    {
      "id": "ssle-4",
      "name": "SSLE 4",
      "problem": {
        "kind": "lwe",
        "dimension": 4096,
        "modulus": "2596139918495516923224825790013441",
        "samples": { "kind": "unlimited" },
        "secret": { "kind": "sparse_ternary" },
        "error": { "kind": "discrete_gaussian", "standard_deviation": "22.4" }
      }
    }
  ]
}
