{
  "format": "lattice-security/parameter-set",
  "version": 1,
  "id": "minimal",
  "name": "Minimal valid parameter set",
  "cases": [
    {
      "id": "lwe",
      "name": "Minimal LWE",
      "problem": {
        "kind": "lwe",
        "dimension": 8,
        "modulus": "17",
        "samples": { "kind": "finite", "count": 8 },
        "secret": { "kind": "uniform_binary" },
        "error": { "kind": "centered_binomial", "eta": 2 }
      }
    }
  ]
}
