{
  "format": "lattice-security/parameter-set",
  "version": 1,
  "id": "boolean",
  "name": "Boolean 参数方案",
  "description": "从 boolean.py 的有效 SMART_EXACT 调用迁移。新服务运行固定公共攻击集合，执行策略在运行时选择。",
  "tags": ["migrated", "python", "boolean"],
  "cases": [
    {
      "id": "key-switch",
      "name": "Key switch",
      "problem": {
        "kind": "lwe",
        "dimension": 768,
        "modulus": "134215681",
        "samples": { "kind": "unlimited" },
        "secret": { "kind": "uniform_binary" },
        "error": { "kind": "discrete_gaussian", "standard_deviation": "819.2" }
      }
    },
    {
      "id": "bootstrapping",
      "name": "Bootstrapping",
      "problem": {
        "kind": "lwe",
        "dimension": 1024,
        "modulus": "134215681",
        "samples": { "kind": "unlimited" },
        "secret": {
          "kind": "sparse_ternary",
          "positive_count": 256,
          "negative_count": 256
        },
        "error": { "kind": "discrete_gaussian", "standard_deviation": "4" }
      }
    }
  ]
}
