{
  "format": "lattice-security/parameter-set",
  "version": 1,
  "id": "thfhe-notebook",
  "name": "THFHE Notebook 参数方案",
  "description": "从 thfhe.ipynb 的活动代码迁移；LWE 与 BSK 角色虽参数相同，仍保留为两个逻辑 case，运行缓存会自动去重。",
  "tags": ["migrated", "notebook", "thfhe"],
  "cases": [
    {
      "id": "lwe",
      "name": "LWE",
      "problem": {
        "kind": "lwe",
        "dimension": 2048,
        "modulus": "9007199254614017",
        "samples": { "kind": "unlimited" },
        "secret": { "kind": "sparse_ternary", "positive_count": 512, "negative_count": 512 },
        "error": { "kind": "discrete_gaussian", "standard_deviation": "3.6" }
      }
    },
    {
      "id": "bsk",
      "name": "BSK",
      "problem": {
        "kind": "lwe",
        "dimension": 2048,
        "modulus": "9007199254614017",
        "samples": { "kind": "unlimited" },
        "secret": { "kind": "sparse_ternary", "positive_count": 512, "negative_count": 512 },
        "error": { "kind": "discrete_gaussian", "standard_deviation": "3.6" }
      }
    },
    {
      "id": "ksk",
      "name": "KSK",
      "problem": {
        "kind": "lwe",
        "dimension": 1024,
        "modulus": "9007199254614017",
        "samples": { "kind": "unlimited" },
        "secret": { "kind": "uniform_binary" },
        "error": { "kind": "discrete_gaussian", "standard_deviation": "228170137.6" }
      }
    }
  ]
}
