{
  "format": "lattice-security/parameter-set",
  "version": 1,
  "id": "nand-notebook",
  "name": "NAND Notebook 参数方案",
  "description": "从 nand.ipynb 的活动 BabyBear 参数迁移；注释掉的 Goldilocks 备选参数未纳入。",
  "tags": ["migrated", "notebook", "nand", "babybear"],
  "cases": [
    {
      "id": "lwe",
      "name": "LWE",
      "problem": {
        "kind": "lwe",
        "dimension": 512,
        "modulus": "2013265921",
        "samples": { "kind": "unlimited" },
        "secret": { "kind": "uniform_binary" },
        "error": { "kind": "discrete_gaussian", "standard_deviation": "56.6" }
      }
    },
    {
      "id": "bsk",
      "name": "BSK",
      "problem": {
        "kind": "lwe",
        "dimension": 1024,
        "modulus": "2013265921",
        "samples": { "kind": "unlimited" },
        "secret": { "kind": "sparse_ternary" },
        "error": { "kind": "discrete_gaussian", "standard_deviation": "51.04" }
      }
    }
  ]
}
